{
  "chapter_id": "27-deepseek-v3.2",
  "chapter_number": 27,
  "title": "DeepSeek V3.2：MoE架构的推理优化",
  "version": 0,
  "status": "draft",
  "dependencies": [
    "09-expert-parallelism",
    "26-qwen-3.5-397b"
  ],
  "dependents": [
    "28-deepseek-v4-pro"
  ],
  "summary": {
    "key_concepts": [],
    "code_interface": "",
    "prerequisites_assumed": [],
    "narrative_tone": "",
    "running_example_stage": ""
  },
  "gates": {
    "implementation_exists": false,
    "tests_pass": false,
    "narrative_complete": false,
    "review_approved": false,
    "downstream_consistency": "needs_check"
  },
  "artifacts": {
    "implementation_dir": "artifacts/27-deepseek-v3.2/implementation",
    "test_dir": "artifacts/27-deepseek-v3.2/tests",
    "narrative_path": "artifacts/27-deepseek-v3.2/narrative/chapter.md",
    "review_path": "artifacts/27-deepseek-v3.2/reviews/review-report.json"
  },
  "changelog": []
}