{
  "chapter_id": "12-dcp-pcp",
  "chapter_number": 12,
  "title": "DCP/PCP：解码/预填充上下文并行",
  "version": 1,
  "status": "published",
  "dependencies": [
    "08-tensor-parallelism",
    "04-continuous-batching"
  ],
  "dependents": [],
  "summary": {
    "key_concepts": [],
    "code_interface": "",
    "prerequisites_assumed": [],
    "narrative_tone": "",
    "running_example_stage": ""
  },
  "gates": {
    "implementation_exists": true,
    "tests_pass": true,
    "narrative_complete": true,
    "review_approved": true,
    "downstream_consistency": "ok"
  },
  "artifacts": {
    "implementation_dir": "artifacts/11-dcp-pcp/implementation",
    "test_dir": "artifacts/11-dcp-pcp/tests",
    "narrative_path": "artifacts/11-dcp-pcp/narrative/chapter.md",
    "review_path": "artifacts/11-dcp-pcp/reviews/review-report.json"
  },
  "changelog": []
}