{
  "chapter_id": "14-triton-primer",
  "chapter_number": 14,
  "title": "Triton算子编写基础",
  "version": 1,
  "status": "published",
  "dependencies": [
    "01-self-attention-fundamentals"
  ],
  "dependents": [
    "15-llama-model-architecture"
  ],
  "summary": {
    "key_concepts": [],
    "code_interface": "",
    "prerequisites_assumed": [],
    "narrative_tone": "",
    "running_example_stage": ""
  },
  "gates": {
    "implementation_exists": true,
    "tests_pass": true,
    "narrative_complete": true,
    "review_approved": true,
    "downstream_consistency": "ok"
  },
  "artifacts": {
    "implementation_dir": "artifacts/14-triton-primer/implementation",
    "test_dir": "artifacts/14-triton-primer/tests",
    "narrative_path": "artifacts/14-triton-primer/narrative/chapter.md",
    "review_path": "artifacts/14-triton-primer/reviews/review-report.json"
  },
  "changelog": []
}