{
  "chapter_id": "27-qwen-3.5-397b",
  "chapter_number": 27,
  "title": "Qwen 3.5-397B：超大规模Dense模型的推理优化",
  "version": 0,
  "status": "draft",
  "dependencies": [
    "21-end-to-end-llama",
    "08-tensor-parallelism"
  ],
  "dependents": [
    "27-deepseek-v3.2"
  ],
  "summary": {
    "key_concepts": [],
    "code_interface": "",
    "prerequisites_assumed": [],
    "narrative_tone": "",
    "running_example_stage": ""
  },
  "gates": {
    "implementation_exists": false,
    "tests_pass": false,
    "narrative_complete": false,
    "review_approved": false,
    "downstream_consistency": "needs_check"
  },
  "artifacts": {
    "implementation_dir": "artifacts/26-qwen-3.5-397b/implementation",
    "test_dir": "artifacts/26-qwen-3.5-397b/tests",
    "narrative_path": "artifacts/26-qwen-3.5-397b/narrative/chapter.md",
    "review_path": "artifacts/26-qwen-3.5-397b/reviews/review-report.json"
  },
  "changelog": []
}