{
  "chapter_id": "06-scheduling",
  "chapter_number": 6,
  "title": "请求调度系统",
  "version": 1,
  "status": "published",
  "dependencies": [
    "05-memory-management"
  ],
  "dependents": [],
  "summary": {
    "key_concepts": [],
    "code_interface": "",
    "prerequisites_assumed": [],
    "narrative_tone": "",
    "running_example_stage": ""
  },
  "gates": {
    "implementation_exists": true,
    "tests_pass": true,
    "narrative_complete": true,
    "review_approved": true,
    "downstream_consistency": "ok"
  },
  "artifacts": {
    "implementation_dir": "artifacts/06-scheduling/implementation",
    "test_dir": "artifacts/06-scheduling/tests",
    "narrative_path": "artifacts/06-scheduling/narrative/chapter.md",
    "review_path": "artifacts/06-scheduling/reviews/review-report.json"
  },
  "changelog": []
}